from,to,detail,type,contract_size,
Matt Hancock,Oxford Nanopore,"Records indicate that the PR firm Tulchan Group was <a target=""_blank"" href=""https://bylinetimes.com/2020/11/16/cronyvirus-ministers-covid-19-meetings-vote-leave-conservatives/"">present at a private meeting</a> in which Health and Social Care Secretary Matt Hancock discussed the government's ""testing ambition"" with Oxford Nanopore",meeting,,
Tulchan Group,Oxford Nanopore,"Records indicate that the PR firm Tulchan Group was <a target=""_blank"" href=""https://bylinetimes.com/2020/11/16/cronyvirus-ministers-covid-19-meetings-vote-leave-conservatives/"">present at a private meeting</a> in which Health and Social Care Secretary Matt Hancock discussed the government's ""testing ambition"" with Oxford Nanopore",meeting,,
Deborah Feldman,Conservative party,"Deborah Feldman ""<a target=""_blank"" href=""https://bylinetimes.com/2020/08/24/the-conservative-crosby-insider-running-coronavirus-meme-firm-topham-guerin/"">was embedded in Conservative Party HQ</a> during the 2015 General Election campaign, running Team2015, which coordinated party volunteers"". She later became ""<a target=""_blank"" href=""https://bylinetimes.com/2020/08/24/the-conservative-crosby-insider-running-coronavirus-meme-firm-topham-guerin/"">head of operations for Zac Goldsmith‚Äôs London Mayoral campaign</a>.""",job,,
UK government,Excalibur Healthcare Services,"Excalibur Healthcare Services was awarded a <a target=""_blank"" href=""https://bylinetimes.com/2020/10/01/135-million-government-contract-ventilators-offshore-linked-firm/"">¬£135.5 million contract to supply ventilators</a> to the UK government",contract,135500,
Alex Bourne,Matt Hancock,"Alex Bourne is an <a target=""_blank"" href=""https://www.theguardian.com/world/2020/nov/26/matt-hancock-former-neighbour-won-covid-test-kit-contract-after-whatsapp-message"">acquaintance and former neighbour</a> of Matt Hancock. Bourne initially offered his services to the Health Secretary by sending him a personal WhatsApp message.",informal,,
Alex Bourne,Hinpack,"Alex Bourne is the <a target=""_blank"" href=""https://find-and-update.company-information.service.gov.uk/company/11472320/persons-with-significant-control"">owner and director</a> of Hinpack Limited",job,,
UK government,Hinpack,"According to <a target=""_blank"" href=""https://www.thetimes.co.uk/article/matt-hancocks-neighbour-won-30m-deal-to-supply-vials-for-covid-tests-gnsbg8vgx"">The Times</a>, Hinpack initially worked with an established distributor to secure orders worth less than ¬£10 million. Hinpack later won a contract to supply test tubes believed to be worth at least ¬£20 million.",contract,30000,
Matt Hancock,Emily Gilruth,Emily Gilruth is Matt Hancock's sister,family,,
Topwood,Matt Hancock,"Matt Hancock owns more than <a target=""_blank"" href=""https://www.bbc.com/news/uk-politics-56768601"">15% of Topwood</a>",corporate,,
Topwood,Emily Gilruth,"Emily Gilruth is an <a target=""_blank"" href=""https://find-and-update.company-information.service.gov.uk/company/04398739/officers"">owner and director at Topwood Ltd</a>.",job,,
NHS Wales,Topwood,"Topwood won <a target=""_blank"" href=""https://www.bbc.com/news/uk-politics-56768601"">¬£300,000 worth of business</a> from NHS Wales.",contract,300,
NHS Wales,NHS England,NHS,corporate,,
NHS England,Matt Hancock,"As health secretary, Matt Hancock is responsible for NHS England",job,,
Topwood,NHS England,"Topwood was <a target=""_blank"" href=""https://www.bbc.com/news/uk-politics-56768601"">approved as a potential supplier</a> for NHS local trusts in 2019, the year after Matt Hancock became health secretary.",contract,,
UK government,Bill Crothers,Bill Crothers was head of government procurement until 2015,job,,
Greensill Capital,Bill Crothers,"Bill Crothers <a target=""_blank"" href=""https://www.ft.com/content/e383bc59-b447-4f19-950d-baf66c51ceb3"">joined Greensill</a> as a part-time adviser in September 2015, two months before leaving the civil service.",job,,
Greensill Capital,David Cameron,"David Cameron <a target=""_blank"" href=""https://www.bbc.com/news/uk-politics-56754210"">began a role as an adviser to Greensill Capital</a> in 2018, just over two years after he left Downing Street.",job,,
UK government,Rishi Sunak,Rishi Sunak is the Chancellor of the Exchequer,job,,
David Cameron,Rishi Sunak,"David Cameron <a target=""_blank"" href=""https://www.bbc.com/news/uk-politics-56681939"">sent messages to the chancellor's private phone last year</a>, lobbying on behalf of Greensill capital.",informal,,
Conservative party,Rishi Sunak,"Rishi Sunak is the Chancellor of the Exchequer, and a Conservative MP.",job,,
David Cameron,Lex Greensill,"Lex Greensill worked as an ""<a target=""_blank"" href=""https://www.bbc.com/news/uk-56706619"">unpaid adviser</a>"" to David Cameron when he was Prime Minister",job,,
Greensill Capital,Lex Greensill,Lex Greensill is the founder of Greensill Capital,job,,
Lex Greensill,Matt Hancock,"Health Secretary Matt Hancock met with former PM David Cameron and businessman Lex Greensill for a ""<a target=""_blank"" href=""https://www.bbc.com/news/uk-56706619"">private drink</a>"" in 2019, to discuss a new payment scheme for the NHS.",meeting,,
Lex Greensill,David Cameron,"Health Secretary Matt Hancock met with former PM David Cameron and businessman Lex Greensill for a ""<a target=""_blank"" href=""https://www.bbc.com/news/uk-56706619"">private drink</a>"" in 2019, to discuss a new payment scheme for the NHS.",meeting,,
Greensill Capital,Sanjeev Gupta,"Sanjeev Gupta <a target=""_blank"" href=""https://www.afr.com/companies/manufacturing/sanjeev-gupta-once-owned-a-stake-in-greensill-20210416-p57jse"">previously held a stake</a> in Greensill Capital, and his conglomerate of metals businesses, GFG Alliance, was Greensill's <a target=""_blank"" href=""https://www.bloomberg.com/opinion/articles/2021-03-11/lex-greensill-and-sanjeev-gupta-became-their-own-worst-enemies"">biggest client</a>.",corporate,,
Conservative party,Sanjeev Gupta,"Sanjeev Gupta has <a target=""_blank"" href=""https://www.thetimes.co.uk/article/steel-tycoon-sanjeev-gupta-hands-out-37-000-in-gifts-to-mps-qvsqz7qhr"">given over ¬£30,000 in donations, gifts, and hospitality to Tory MP Nigel Evans</a> since 2015.",donor,30,
John Glen,David Cameron,"In addition to texting the Chancellor, David Cameron <a target=""_blank"" href=""https://www.bbc.com/news/uk-politics-56578838"">also contacted two Treasury ministers</a>, John Glen and Jesse Norman, about Greensill.",meeting,,
Jesse Norman,David Cameron,"In addition to texting the Chancellor, David Cameron <a target=""_blank"" href=""https://www.bbc.com/news/uk-politics-56578838"">also contacted two Treasury ministers</a>, John Glen and Jesse Norman, about Greensill.",meeting,,
John Glen,Conservative party,John Glen is a Conservative MP,job,,
David Brierwood,Greensill Capital,"David Brierwood was a <a target=""_blank"" href=""https://find-and-update.company-information.service.gov.uk/officers/Tdt9NXJ7ZVS9GWj56Z-yihY7c2w/appointments"">director at Greensill Capital</a> from 2015 to 2018.",job,,
David Brierwood,UK government,"David Brierwood was appointed as a ""<a target=""_blank"" href=""https://www.theguardian.com/politics/2021/apr/15/second-cabinet-office-adviser-hired-by-greensill-while-in-civil-service?CMP=Share_AndroidApp_Other"">crown representative</a>"" by the Cabinet Office during David Cameron's tenure as PM. He held this role while also being on the board of Greensill Capital.",job,,
David Brierwood,Morgan Stanley,"David Brierwood is a <a target=""_blank"" href=""https://news.sky.com/story/david-cameron-lobbying-government-adviser-david-brierwood-became-greensill-director-months-after-taking-whitehall-role-12276957"">former investment banker</a> at Morgan Stanley.",job,,
Lex Greensill,UK government,"Lex Greensill was appointed as a ""<a target=""_blank"" href=""https://www.theguardian.com/politics/2021/apr/15/second-cabinet-office-adviser-hired-by-greensill-while-in-civil-service?CMP=Share_AndroidApp_Other"">crown representative</a>"" by the Cabinet Office in 2014. He had previously worked as a government adviser.",job,,
Jeremy Heywood,Morgan Stanley,"Jeremy Heywood was a <a target=""_blank"" href=""https://en.wikipedia.org/wiki/Jeremy_Heywood"">managing director</a> of the UK Investment Banking Division at Morgan Stanley.",job,,
Jeremy Heywood,UK government,"Jeremy Heywood was a <a target=""_blank"" href=""https://en.wikipedia.org/wiki/Jeremy_Heywood"">senior civil servant</a> who served as Cabinet Secretary to David Cameron and Theresa May.",job,,
Lex Greensill,Morgan Stanley,"Before founding Greensill Capital, <a target=""_blank"" href=""https://en.wikipedia.org/wiki/Lex_Greensill"">Lex Greensill worked at investment bank Morgan Stanley</a>.",job,,
Nigel Boardman,Slaughter and May,"Nigel Boardman was a <a target=""_blank"" href=""https://www.theguardian.com/politics/2021/apr/20/firm-lobbying-inquiry-chair-nigel-boardman-won-government-contracts-past-year"">partner at Slaughter and May</a> until 2019, and remains a ""senior consultant"" at the firm.",job,,
Nigel Boardman,Greensill Capital,"Nigel Boardman has been <a target=""_blank"" href=""https://www.theguardian.com/politics/2021/apr/20/firm-lobbying-inquiry-chair-nigel-boardman-won-government-contracts-past-year"">appointed to lead the inquiry into the Greensill lobbying scandal</a>.",job,,
Slaughter and May,UK government,"Slaughter and May has won <a target=""_blank"" href=""https://www.theguardian.com/politics/2021/apr/20/firm-lobbying-inquiry-chair-nigel-boardman-won-government-contracts-past-year"">at least 10 government contracts worth over ¬£7 million</a> in the last year alone.",contract,7230,
Boris Johnson,James Dyson,"In March 2020, <a target=""_blank"" href=""https://www.bbc.com/news/uk-politics-56839459"">James Dyson texted the PM, Boris Johnson</a>, asking for assurances about the tax status of his employees. Johnson replied that the issue was ""fixed"".",meeting,,
Conservative party,Michelle Donelan,Michelle Donelan is a Conservative MP and minister.,job,,
James Dyson,Michelle Donelan,"James Dyson <a target=""_blank"" href=""http://search.electoralcommission.org.uk/English/Search/Donations?currentPage=1&rows=10&query=dyson&sort=AcceptedDate&order=desc&tab=1&et=pp&et=ppm&et=tp&et=perpar&et=rd&isIrishSourceYes=true&isIrishSourceNo=true&prePoll=false&postPoll=true&register=gb&register=ni&register=none&optCols=Register&optCols=CampaigningName&optCols=AccountingUnitsAsCentralParty&optCols=IsSponsorship&optCols=IsIrishSource&optCols=RegulatedDoneeType&optCols=CompanyRegistrationNumber&optCols=Postcode&optCols=NatureOfDonation&optCols=PurposeOfVisit&optCols=DonationAction&optCols=ReportedDate&optCols=IsReportedPrePoll&optCols=ReportingPeriodName&optCols=IsBequest&optCols=IsAggregation"">donated ¬£11,450 to Conservative MP Michelle Donelan</a> from 2016 to 2017.",donor,11.45,
Jon Cunliffe,UK government,Jon Cunliffe is the Deputy Governor of the Bank of England for Financial Stability.,job,,
Tom Scholar,UK government,Tom Scholar is a British civil servant currently serving as Permanent Secretary at HM Treasury.,job,,
Tom Scholar,David Cameron,"David Cameron <a target=""_blank"" href=""https://www.theguardian.com/politics/2021/apr/22/david-cameron-lobbied-top-treasury-official-by-phone-mps-told"">called and sent text messages to Tom Scholar</a>, the Treasury's most senior civil servant, to demand help for the now-collapsed Greensill Capital. Scholar said that Cameron had his professional phone number because he ""used to work for him"".",meeting,,
Charles Roxburgh,UK government,Charles Roxburgh is a British civil servant currently serving as Second Permanent Secretary to HM Treasury.,job,,
Charles Roxburgh,Greensill Capital,"Treasury civil servant Charles Roxburgh held <a target=""_blank"" href=""https://www.theguardian.com/politics/2021/apr/22/david-cameron-lobbied-top-treasury-official-by-phone-mps-told"">nine meetings with Greensill</a> last year, as the company repeatedly tried to gain access to the government's COVID support schemes.",meeting,,
Charles Roxburgh,Bill Crothers,"Roxburgh said he was <a target=""_blank"" href=""https://www.theguardian.com/politics/2021/apr/22/david-cameron-lobbied-top-treasury-official-by-phone-mps-told"">introduced to Greensill by Bill Crothers</a>, another civil servant who held a paid position with Greensill during his time in public service.",meeting,,
Jon Cunliffe,David Cameron,"In March 2020, <a target=""_blank"" href=""https://www.bankofengland.co.uk/freedom-of-information/2021/communications-between-david-cameron-and-senior-bank-officials-about-greensill-capital-and-the-ccff"">David Cameron emailed Jon Cunliffe</a>, the Deputy Governor of the Bank of England for Financial Stability, to arrange a meeting on behalf of his employer, Greensill Capital.",meeting,,
David Brownlow,Conservative party,"David Brownlow has given <a target=""_blank"" href=""http://search.electoralcommission.org.uk/?currentPage=5&rows=10&query=brownlow&sort=AcceptedDate&order=desc&tab=1&et=pp&et=ppm&et=tp&et=perpar&et=rd&isIrishSourceYes=true&isIrishSourceNo=true&prePoll=false&postPoll=true&register=gb&register=ni&register=none&optCols=Register&optCols=CampaigningName&optCols=AccountingUnitsAsCentralParty&optCols=IsSponsorship&optCols=IsIrishSource&optCols=RegulatedDoneeType&optCols=CompanyRegistrationNumber&optCols=Postcode&optCols=NatureOfDonation&optCols=PurposeOfVisit&optCols=DonationAction&optCols=ReportedDate&optCols=IsReportedPrePoll&optCols=ReportingPeriodName&optCols=IsBequest&optCols=IsAggregation"">over ¬£2 million in donations</a> to the Conservative party. Leaked emails show that <a target=""_blank"" href=""https://www.dailymail.co.uk/news/article-9492829/Leaked-memo-shows-Tory-chief-knew-58-000-donation-Boris-Johnsons-Downing-Street-flat.html"">Brownlow also donated ¬£60,000</a> to the Conservative party to cover rennovation costs for Boris Johnson's Downing Street flat. Brownlow was formerly Vice-Chairman of the Conservative party.",donor,2081,
David Brownlow,Boris Johnson,"Leaked emails show that <a target=""_blank"" href=""https://www.dailymail.co.uk/news/article-9492829/Leaked-memo-shows-Tory-chief-knew-58-000-donation-Boris-Johnsons-Downing-Street-flat.html"">Brownlow donated ¬£60,000</a> to the Conservative party to cover rennovation costs for Boris Johnson's Downing Street flat.",donor,60,
David Brownlow,Huntswood,"Huntswood is a business services firm <a target=""_blank"" href=""https://find-and-update.company-information.service.gov.uk/company/03969379/officers"">founded by David Brownlow</a>.",job,,
Huntswood,UK government,"Huntswood was one of 37 suppliers <a target=""_blank"" href=""https://www.contractsfinder.service.gov.uk/notice/3af07f81-67ab-4393-b5ee-ed0982b4524b?origin=SearchResults&p=1"">awarded a contract</a> by the UK Financial Conduct Authority in 2017 worth up to ¬£120 million. Huntswood was also awarded a <a target=""_blank"" href=""https://www.contractsfinder.service.gov.uk/notice/9900be3a-a75e-4f9e-becf-4007ac08ae56?origin=SearchResults&p=1"">contract worth up to ¬£60,000</a> by the UK Student Loans Company in 2018.",contract,3303,
Samantha Cameron,David Cameron,David and Samantha Cameron are married.,family,,
David Brownlow,Samantha Cameron,"David Brownlow is a <a target=""_blank"" href=""https://find-and-update.company-information.service.gov.uk/company/10410585/officers"">director of Samantha Cameron's clothing company</a>.",job,,
Theresa May,Conservative party,Theresa May is a Conservative MP and former Prime Minister.,job,,
David Brownlow,Theresa May,"Since 2015, David Brownlow has <a target=""_blank"" href=""http://search.electoralcommission.org.uk/?currentPage=5&rows=10&query=brownlow&sort=AccountingUnitName&order=asc&tab=1&et=pp&et=ppm&et=tp&et=perpar&et=rd&isIrishSourceYes=true&isIrishSourceNo=true&prePoll=false&postPoll=true&register=gb&register=ni&register=none&optCols=Register&optCols=CampaigningName&optCols=AccountingUnitsAsCentralParty&optCols=IsSponsorship&optCols=IsIrishSource&optCols=RegulatedDoneeType&optCols=CompanyRegistrationNumber&optCols=Postcode&optCols=NatureOfDonation&optCols=PurposeOfVisit&optCols=DonationAction&optCols=ReportedDate&optCols=IsReportedPrePoll&optCols=ReportingPeriodName&optCols=IsBequest&optCols=IsAggregation"">donated over ¬£124,000</a> to the Maidenhead branch of the Conservative party, which is Theresa May's constituency. David Brownlow was <a target=""_blank"" href=""https://en.wikipedia.org/wiki/David_Brownlow,_Baron_Brownlow_of_Shurlock_Row"">nominated for a peerage by Theresa May</a> in her resignation honours in 2019.",donor,124,
William Hobhouse,Kate Hobhouse,Kate and William Hobhouse are married.,family,,
William Hobhouse,Conservative party,"William Hobhouse <a target=""_blank"" href=""http://search.electoralcommission.org.uk/?currentPage=1&rows=10&query=william%20hobhouse&sort=RegulatedEntityName&order=asc&tab=1&et=pp&et=ppm&et=tp&et=perpar&et=rd&isIrishSourceYes=true&isIrishSourceNo=true&prePoll=false&postPoll=true&register=gb&register=ni&register=none&optCols=Register&optCols=CampaigningName&optCols=AccountingUnitsAsCentralParty&optCols=IsSponsorship&optCols=IsIrishSource&optCols=RegulatedDoneeType&optCols=CompanyRegistrationNumber&optCols=Postcode&optCols=NatureOfDonation&optCols=PurposeOfVisit&optCols=DonationAction&optCols=ReportedDate&optCols=IsReportedPrePoll&optCols=ReportingPeriodName&optCols=IsBequest&optCols=IsAggregation"">donated ¬£63,000</a> to the Conservative party in 2009.",donor,63,
William Hobhouse,Vote Leave,"William Hobhouse <a target=""_blank"" href=""http://search.electoralcommission.org.uk/?currentPage=1&rows=10&query=william%20hobhouse&sort=RegulatedEntityName&order=asc&tab=1&et=pp&et=ppm&et=tp&et=perpar&et=rd&isIrishSourceYes=true&isIrishSourceNo=true&prePoll=false&postPoll=true&register=gb&register=ni&register=none&optCols=Register&optCols=CampaigningName&optCols=AccountingUnitsAsCentralParty&optCols=IsSponsorship&optCols=IsIrishSource&optCols=RegulatedDoneeType&optCols=CompanyRegistrationNumber&optCols=Postcode&optCols=NatureOfDonation&optCols=PurposeOfVisit&optCols=DonationAction&optCols=ReportedDate&optCols=IsReportedPrePoll&optCols=ReportingPeriodName&optCols=IsBequest&optCols=IsAggregation"">donated ¬£40,350</a> to the Vote Leave campaign.",donor,40,
Kate Hobhouse,Conservative party,"Kate Hobhouse has <a target=""_blank"" href=""http://search.electoralcommission.org.uk/?currentPage=1&rows=10&query=anna%20hobhouse&sort=RegulatedEntityName&order=asc&tab=1&et=pp&et=ppm&et=tp&et=perpar&et=rd&isIrishSourceYes=true&isIrishSourceNo=true&prePoll=false&postPoll=true&register=gb&register=ni&register=none&optCols=Register&optCols=CampaigningName&optCols=AccountingUnitsAsCentralParty&optCols=IsSponsorship&optCols=IsIrishSource&optCols=RegulatedDoneeType&optCols=CompanyRegistrationNumber&optCols=Postcode&optCols=NatureOfDonation&optCols=PurposeOfVisit&optCols=DonationAction&optCols=ReportedDate&optCols=IsReportedPrePoll&optCols=ReportingPeriodName&optCols=IsBequest&optCols=IsAggregation"">donated ¬£130,500</a> to the Conservative party.",donor,130.5,
William Hobhouse,Soane Britain,"William Hobhouse was a <a target=""_blank"" href=""https://find-and-update.company-information.service.gov.uk/company/03360853/officers"">director of Soane Britain</a> from July 2015 to March 2021. As of April 2020, Hobhouse also <a target=""_blank"" href=""https://find-and-update.company-information.service.gov.uk/company/03360853/filing-history"">held shares in the company</a>.",job,,
Carrie Symonds,Soane Britain,"Carrie Symonds was reportedly <a target=""_blank"" href=""https://www.independent.co.uk/news/uk/politics/boris-johnson-flat-refurb-renovation-b1838412.html"">inspired by Soane Britain designer Lulu Lytle</a> for the redecoration of the No. 11 Downing Street flat that she shares with PM Boris Johnson.",informal,,
Carrie Symonds,Boris Johnson,Carrie Symonds is the fianc√©e of Boris Johnson,family,,
Carrie Symonds,Conservative party,Carrie Symonds is a former Conservertive party press officer.,job,,
Kate Hobhouse,Soane Britain,"As of April 2020, both Kate and William Hobhouse <a target=""_blank"" href=""https://find-and-update.company-information.service.gov.uk/company/03360853/filing-history"">held shares in Soane Britain</a>.",corporate,,
Kate Hobhouse,Garfield Weston Foundation,"Kate Hobhouse is a <a target=""_blank"" href=""https://register-of-charities.charitycommission.gov.uk/charity-search/-/charity-details/230260/charity-overview"">trustee of the Garfield Weston Foundation</a>, the charitable foundation run by her family.",job,,
Conservative party,Garfield Weston Foundation,"The Garfield Weston Foundation was reprimanded by the Charity Commission for <a target=""_blank"" href=""https://www.civilsociety.co.uk/news/garfield-weston-foundation-censured-for-links-to-political-donations.html"">making donations totalling ¬£900,000 to the Conservative party</a> between 1993 and 2005 without proper oversight.",donor,900,
Centre for Policy Studies,Garfield Weston Foundation,"The Garfield Weston Foundation <a target=""_blank"" href=""https://www.thetimes.co.uk/article/westons-breached-charity-law-over-tory-donations-xc859gg7gwm"">donated ¬£70,000 to the Center for Policy Studies</a>, a right-wing think tank.",donor,,
Jo Johnson,James Dyson,"As Universities Minister, Jo Johnson <a target=""_blank"" href=""https://www.dyson.com/newsroom/overview/features/october-2020/dyson-institute-degree-powers"">helped James Dyson set up</a> the Dyson Institute of Engineering and Technology. After resigning as a minister in September 2019, Jo Johnson was <a target=""_blank"" href=""https://find-and-update.company-information.service.gov.uk/company/10701273/officers"">appointed as a director of the Dyson Institute</a> in February 2020.",job,,
Bunzl,Tulchan Group,"Bunzl is a client of the lobbying firm, Tulchan.",corporate,,
Bunzl,UK government,"Bunzl has been awarded government PPE contracts worth <a target=""_blank"" href=""https://www.ft.com/content/acfe72b3-543f-4bd5-8b47-ddf96650b5af"">at least</a> <a target=""_blank"" href=""https://www.ft.com/content/b1659548-7cd0-4626-8406-7b2338d04489"">¬£84 million</a> during the pandemic - all awarded without a competitive tender process.",contract,84000,
Bunzl,Andrew Feldman,"<a target=""_blank"" href=""https://www.ft.com/content/b1659548-7cd0-4626-8406-7b2338d04489"">Emails obtained by the Good Law Project</a> indicate that Andrew Feldman used his role as an ""unpaid adviser"" to urge officials to buy PPE from Bunzl, which is a client of his lobbying firm, Tulchan.",job,,
Priti Patel,Conservative party,Priti Patel is a Conservative MP and Home Secretary.,job,,
Priti Patel,Michael Gove,"According to the Daily Mail, <a target=""_blank"" href=""https://www.dailymail.co.uk/news/article-9580491/Priti-Patel-20m-PPE-lobbying-storm.html"">Priti Patel lobbied Cabinet Office minister Michael Gove</a> in 2020 over a ¬£20 million contract for surgical masks for Pharmaceuticals Direct Ltd (PDL).",informal,,
Samir Jassal,Conservative party,"<a target=""_blank"" href=""https://www.bbc.com/news/uk-56667960"">Samir Jassal</a> is a former Conservative Party councillor and Conservative candidate for MP. He donated ¬£4,000 to the party in 2016.",job,,
Samir Jassal,Boris Johnson,"Samir Jassal has <a target=""_blank"" href=""https://www.bbc.com/news/uk-56667960"">accompanied the Prime Minister</a> on official visits and campaign trips.",informal,,
Priti Patel,Samir Jassal,"According to his LinkedIn profile, Jassal <a target=""_blank"" href=""https://www.bbc.com/news/uk-56667960"">worked as an unpaid adviser</a> to Priti Patel between 2014 and 2015. In 2020, Patel lobbied the government on behalf of Pharmaceuticals Direct Ltd after Jassal approached her. She did not disclose the connection, in breach of the Ministerial Code.",job,,
Samir Jassal,Pharmaceuticals Direct Ltd,"Samir Jassal <a target=""_blank"" href=""https://www.bbc.com/news/uk-56667960"">acted as a ""consultant""</a> for Pharmaceuticals Direct Ltd.",job,,
UK government,Pharmaceuticals Direct Ltd,"Priti Patel <a target=""_blank"" href=""https://www.dailymail.co.uk/news/article-9580491/Priti-Patel-20m-PPE-lobbying-storm.html"">lobbied the government</a> to award a ¬£20 million contract for masks to PDL, but the masks were deemed ""not suitable"" by Matt Hancock. Weeks later, PDL was <a target=""_blank"" href=""https://www.contractsfinder.service.gov.uk/notice/68b10473-927b-4609-9fe0-9c1c9488f02e?origin=SearchResults&p=1"">awarded a ¬£102 million no-bid contract</a> to supply a different type of mask.",contract,102600,
Times Place Brasseries Ltd,Nathan Engelbrecht,"Nathan Engelbrecht was <a target=""_blank"" href=""https://find-and-update.company-information.service.gov.uk/company/08737045/officers"">a director of Times Place Brasseries Ltd</a> from 2014 to 2019, and was a shareholder from 2017 to 2019.",job,,
Times Place Brasseries Ltd,Tim Whyte,"Tim Whyte was <a target=""_blank"" href=""https://find-and-update.company-information.service.gov.uk/company/08737045/officers"">a director of Times Place Brasseries Ltd</a> from 2016 to 2018, and was a shareholder from 2017 to 2018.",job,,
Nathan Engelbrecht,Ayanda Capital,Nathan Engelbrecht is a co-founder of Ayanda Capital.,job,,
Tim Whyte,Karen Brost Whyte,"Tim and Karen Whyte are <a target=""_blank"" href=""https://www.standard.co.uk/news/uk/ppe-procurement-scandal-uk-2021-b935842.html#r3z-addoor"">married</a>.",family,,
Karen Brost Whyte,Luxe Lifestyle,"Luxe Lifestyle is <a target=""_blank"" href=""https://find-and-update.company-information.service.gov.uk/company/11703750/officers"">owned by</a> Karen Whyte.",job,,
